323	OVERLAP	昔は一律に行われてきたが、最近は、学校５日制や共働きが増えたことで、廃止したり面談や懇談会に切り替えたり[ENT]するケースも[ENT]ある。
324	OVERLAP	逆に[ENT]復活させる学校も。[SEP]地域や状況によってあり方も[ENT]多様化しているようだ。
325	OVERLAP	地域や状況によってあり方も[ENT]多様化しているようだ。[SEP]埼玉県の草加市立八幡小学校は昨年、家庭訪問を[ENT]やめ、代わりに「地域訪問」に切り替えた。
326	BEFORE	埼玉県の草加市立八幡小学校は昨年、家庭訪問を[ENT]やめ、代わりに「地域訪問」に[ENT]切り替えた。
327	OVERLAP	教師が学区内をまわり、児童の通学路や、生活科の教材になりそうな場所を[ENT]調べたり[ENT]するのだという。
328	AFTER	廃止の理由は、授業時間を[ENT]確保するため。[SEP]それ以前は５日[ENT]かけ家庭訪問していたが、地域訪問は２日。
329	OVERLAP	それ以前は５日[ENT]かけ[ENT]家庭訪問していたが、地域訪問は２日。
330	BEFORE	それ以前は５日かけ[ENT]家庭訪問していたが、地域訪問は２日。[SEP]６年生なら６時間分の授業が[ENT]確保できる。
331	VAGUE	と同校の川野清教頭は[ENT]説明する。[SEP]保護者は、「家庭訪問」「個人面談」「グループ面談」から[ENT]選ぶ。
332	AFTER	保護者は、「家庭訪問」「個人面談」「グループ面談」から[ENT]選ぶ。[SEP]教頭は「これまでと[ENT]赴任した学校でも、仕事が休めないと断ってきたり、ＰＴＡとの懇談でやめてほしいと要望が出されたりすることもあった」話す。
333	BEFORE	教頭は「これまでと[ENT]赴任した学校でも、仕事が[ENT]休めないと断ってきたり、ＰＴＡとの懇談でやめてほしいと要望が出されたりすることもあった」話す。
334	OVERLAP	教頭は「これまでと赴任した学校でも、仕事が休めないと[ENT]断って[ENT]きたり、ＰＴＡとの懇談でやめてほしいと要望が出されたりすることもあった」話す。
335	VAGUE	教頭は「これまでと赴任した学校でも、仕事が休めないと断って[ENT]きたり、ＰＴＡとの懇談で[ENT]やめてほしいと要望が出されたりすることもあった」話す。
336	OVERLAP	教頭は「これまでと赴任した学校でも、仕事が休めないと断ってきたり、ＰＴＡとの懇談でやめてほしいと要望が[ENT]出されたり[ENT]することもあった」話す。
337	AFTER	教頭は「これまでと赴任した学校でも、仕事が休めないと断ってきたり、ＰＴＡとの懇談でやめてほしいと要望が出されたりすることもあった」[ENT]話す。[SEP]家庭訪問の希望は「１人というクラスもと[ENT]あった」いう。
338	BEFORE	家庭訪問の希望は「１人というクラスもと[ENT]あった」[ENT]いう。
339	BEFORE	担任は家まで[ENT]行くが、親は[ENT]いてもいなくてもいい。
340	OVERLAP	学区制の弾力化で広域化が[ENT]進む品川区では、「（区[UNK]）。[ENT]実施している学校が多いが、『見直しの検討も必要かも』という声も聞く」
341	VAGUE	学区制の弾力化で広域化が進む品川区では、「（区[UNK]）。実施している学校が多いが、『見直しの検討も必要かも』という声も[ENT]聞く」[SEP]通常の家庭訪問に[ENT]戻した学校もある。
342	BEFORE	静岡県下田市の下田小学校は昨年、地域訪問を[ENT]やめ、家庭訪問を[ENT]復活させた。
343	BEFORE	「という教師の声も受け持って間もないのに、短時間で内容ある話は[ENT]できない」[ENT]あったという。
344	BEFORE	「という教師の声も受け持って間もないのに、短時間で内容ある話はできない」[ENT]あったと[ENT]いう。
345	BEFORE	その場での成果は求めず、むしろ今後の関係をスムーズにするための『顔あわせ』と[ENT]位置づけた」[SEP]と[ENT]いう。
346	BEFORE	徳島県鳴門市の大津西小学校は、夏休みに家庭訪問を[ENT]実施していた。[SEP]だが、昨年からこの時期に[ENT]もどした。
347	BEFORE	小学校教員歴が３２年[ENT]あり、千葉大学教育学部で非常勤講師を[ENT]務める向山洋一さんによると、１５年ぐらい前から「玄関先だけにという家庭がして」でてきた。
348	AFTER	小学校教員歴が３２年あり、千葉大学教育学部で非常勤講師を[ENT]務める向山洋一さんによると、１５年ぐらい前から「玄関先だけにという家庭が[ENT]して」でてきた。
349	BEFORE	「共働きの増加や親がプライバシーをと守りたい意識が強くなってきたのに加え、学校５日制導入で授業時間が少なくなったことが、家庭訪問見直しに拍車を[ENT]かけた」[ENT]分析する。
350	OVERLAP	今は、やったりやらなかったり、地域訪問や地域懇談にして[ENT]時間短縮する「中間系」も[ENT]あったりと、実施状況もバラバラ。
351	AFTER	小学校より、受験を控える中学校の方が廃止するケースが多いようだ、と[ENT]いう。[SEP]日本大学文理学部の佐藤秀夫教授によると、家庭訪問は明治初期に、不就学児を学校に[ENT]通わせるように親を説得する目的で始まったという。
352	AFTER	日本大学文理学部の佐藤秀夫教授によると、家庭訪問は明治初期に、不就学児を学校に[ENT]通わせるように親を[ENT]説得する目的で始まったという。
353	AFTER	日本大学文理学部の佐藤秀夫教授によると、家庭訪問は明治初期に、不就学児を学校に通わせるように親を[ENT]説得する目的で[ENT]始まったという。
354	BEFORE	日本大学文理学部の佐藤秀夫教授によると、家庭訪問は明治初期に、不就学児を学校に通わせるように親を説得する目的で[ENT]始まったと[ENT]いう。
355	OVERLAP	このころには、今と同じように、子どもの家庭環境を[ENT]把握するのが目的と[ENT]なっている。
356	BEFORE	「師範学校付属校のような中核校からじわじわと周辺にと佐藤教授は[ENT]広がっていったのでは」[ENT]みている。
357	OVERLAP	「師範学校付属校のような中核校からじわじわと周辺にと佐藤教授は広がっていったのでは」[ENT]みている。[SEP]また、家庭と学校の不干渉が[ENT]徹底している欧米では、家庭訪問は基本的に「とない」いう。
358	OVERLAP	また、家庭と学校の不干渉が徹底している欧米では、家庭訪問は基本的に「と[ENT]ない」[ENT]いう。
359	VAGUE	また、家庭と学校の不干渉が徹底している欧米では、家庭訪問は基本的に「とない」[ENT]いう。[SEP]１０分のために半日休み／[ENT]気兼ねせずに本音話せる
360	OVERLAP	１０分のために半日休み／[ENT]気兼ねせずに本音[ENT]話せる
361	VAGUE	１０分のために半日休み／気兼ねせずに本音[ENT]話せる[SEP]中学校で「家庭訪問がという説明を[ENT]ない」聞いて、思わず「ヤッター」と叫んでしまった。
362	AFTER	兄弟の家庭訪問が同じ日に[ENT]なるように[ENT]調整してもらい、その日の午後は休みをもらった。
363	BEFORE	兄弟の家庭訪問が同じ日になるように[ENT]調整してもらい、その日の午後は休みを[ENT]もらった。
364	OVERLAP	１０分程度のために、[ENT]苦労して時間を[ENT]やりくりしても、雑談になることも多い。
365	BEFORE	１０分程度のために、苦労して時間を[ENT]やりくりしても、雑談に[ENT]なることも多い。
366	OVERLAP	[ENT]掃除して、[ENT][UNK]って、こちらも自然体を見せてない。
367	VAGUE	掃除して、[UNK]って、こちらも自然体を[ENT]見せてない。[SEP]意味が[ENT]ないのでは。
368	VAGUE	意味が[ENT]ないのでは。[SEP]「と、新学期の保護者会で担任から説明を今年から家庭訪問の時は[ENT]会えなくてもいいです」受けた。
369	AFTER	「と、新学期の保護者会で担任から説明を今年から家庭訪問の時は[ENT]会えなくてもいいです」[ENT]受けた。
370	BEFORE	「と、新学期の保護者会で担任から説明を今年から家庭訪問の時は会えなくてもいいです」[ENT]受けた。[SEP][ENT]掃除しなくてもいいや、とホッとした。
371	VAGUE	先生は玄関先で[ENT]帰るのか、リビングまで[ENT]上がるのか。
372	BEFORE	それで掃除の範囲を[ENT]決めていたこともある。[SEP]結局、家庭訪問は[ENT]受けた。
373	VAGUE	構えてしまい、他人に聞かれたくない話は[ENT]しにくい。[SEP]時間変更に困惑／虐待発見も／しつけ方を[ENT]見破る
374	BEFORE	昔は、「どうぞ、勉強部屋もと見てください」[ENT]通されたこともあった。[SEP]今は玄関先で、短時間で[ENT]切り上げるように気をつかっている。
375	OVERLAP	今は玄関先で、短時間で[ENT]切り上げるように気を[ENT]つかっている。
376	OVERLAP	訪問日当日に「今日はムリ」「時間をと変えろ」[ENT]言って[ENT]きたり、子どもの習い事の送迎で日程を変えさせたり…。
377	VAGUE	訪問日当日に「今日はムリ」「時間をと変えろ」言って[ENT]きたり、子どもの習い事の送迎で日程を[ENT]変えさせたり…。
378	OVERLAP	訪問日当日に「今日はムリ」「時間をと変えろ」言ってきたり、子どもの習い事の送迎で日程を[ENT]変えさせたり…。[SEP]苦労は[ENT]絶えない。
379	VAGUE	苦労は[ENT]絶えない。[SEP]短時間の訪問で、勉強部屋を[ENT]見るでもなく、心をうち解けず終わることも多い。
380	BEFORE	短時間の訪問で、勉強部屋を見るでもなく、心を[ENT]うち解けず[ENT]終わることも多い。
381	BEFORE	半面、最近は調査票もプライバシー保護で詳しい記入が[ENT]なく、親の顔が[ENT]見えてこない。
382	AFTER	親を知るいい機会だし、虐待発見のきっかけに[ENT]なることもあると[ENT]思う。
383	VAGUE	親を知るいい機会だし、虐待発見のきっかけになることもあると[ENT]思う。[SEP]たとえ玄関先でも、家の雰囲気が[ENT]わかる。
384	OVERLAP	どんなに[UNK]いても、話を[ENT]しているそばで子どもが[ENT]暴れても注意しなかったり、テレビがつけっぱなしだったりとか…。
385	OVERLAP	どんなに[UNK]いても、話をしているそばで子どもが[ENT]暴れても[ENT]注意しなかったり、テレビがつけっぱなしだったりとか…。
386	OVERLAP	親のしつけ方など、子どもの[ENT]育つ環境を[ENT]知る重要な手がかりだ。
387	BEFORE	ミツカンが首都圏の３０〜５０代の主婦を対象に[ENT]行ったアンケートで、こんな結果が[ENT]出た。
388	BEFORE	家庭で食べるサラダの種類や味付けが、マヨネーズ一辺倒ではなく[ENT]多様化してきたことが[ENT]うかがわれた。
389	AFTER	家庭で食べるサラダの種類や味付けが、マヨネーズ一辺倒ではなく多様化してきたことが[ENT]うかがわれた。[SEP]サラダと[ENT]聞いて[UNK]ものは、野菜サラダ８４・６％、ポテトサラダ７８・１％、マカロニサラダ４９・１％の順。
390	BEFORE	サラダと[ENT]聞いて[ENT][UNK]ものは、野菜サラダ８４・６％、ポテトサラダ７８・１％、マカロニサラダ４９・１％の順。
391	AFTER	財務省が９日[ENT]発表した４月末の外貨準備高は３６２６億１１００万ドルと[ENT]なり、前月末に比べ１１億３９００万ドル増と、３カ月ぶりにプラスに転じた。
392	AFTER	財務省が９日発表した４月末の外貨準備高は３６２６億１１００万ドルとなり、前月末に比べ１１億３９００万ドル増と、３カ月ぶりにプラスに[ENT]転じた。[SEP]外国為替市場でユーロが対ドルで[ENT]上昇したことに伴い、ユーロ建て資産が増えたことが主因。
393	BEFORE	外国為替市場でユーロが対ドルで上昇したことに伴い、ユーロ建て資産が[ENT]増えたことが主因。[SEP]国際通貨基金（ＩＭＦ）が[ENT]集計した国際比較では、日本が１７カ月連続で世界一。
394	OVERLAP	国際通貨基金（ＩＭＦ）が[ENT]集計した国際比較では、日本が１７カ月連続で世界一。[SEP]米国のエネルギー政策見直しを[ENT]指揮しているチェイニー副大統領は８日、ＣＮＮテレビのインタビューで「環境対策、経済性の両面から原子力（発電）はと好ましい選択肢だ」語り、１７日に公表される見通しのブッシュ政権のエネルギー政策の大綱で、１９７０年代から事実上、凍結されている原子力発電所の新規建設を打ち出す考えを示した。
395	BEFORE	米国のエネルギー政策見直しを指揮しているチェイニー副大統領は８日、ＣＮＮテレビのインタビューで「環境対策、経済性の両面から原子力（発電）はと好ましい選択肢だ」[ENT]語り、１７日に[ENT]公表される見通しのブッシュ政権のエネルギー政策の大綱で、１９７０年代から事実上、凍結されている原子力発電所の新規建設を打ち出す考えを示した。
396	OVERLAP	米国のエネルギー政策見直しを指揮しているチェイニー副大統領は８日、ＣＮＮテレビのインタビューで「環境対策、経済性の両面から原子力（発電）はと好ましい選択肢だ」語り、１７日に[ENT]公表される見通しのブッシュ政権のエネルギー政策の大綱で、１９７０年代から事実上、[ENT]凍結されている原子力発電所の新規建設を打ち出す考えを示した。
397	OVERLAP	米国のエネルギー政策見直しを指揮しているチェイニー副大統領は８日、ＣＮＮテレビのインタビューで「環境対策、経済性の両面から原子力（発電）はと好ましい選択肢だ」語り、１７日に公表される見通しのブッシュ政権のエネルギー政策の大綱で、１９７０年代から事実上、[ENT]凍結されている原子力発電所の新規建設を[ENT]打ち出す考えを示した。
398	AFTER	米国のエネルギー政策見直しを指揮しているチェイニー副大統領は８日、ＣＮＮテレビのインタビューで「環境対策、経済性の両面から原子力（発電）はと好ましい選択肢だ」語り、１７日に公表される見通しのブッシュ政権のエネルギー政策の大綱で、１９７０年代から事実上、凍結されている原子力発電所の新規建設を[ENT]打ち出す考えを[ENT]示した。
399	VAGUE	米国のエネルギー政策見直しを指揮しているチェイニー副大統領は８日、ＣＮＮテレビのインタビューで「環境対策、経済性の両面から原子力（発電）はと好ましい選択肢だ」語り、１７日に公表される見通しのブッシュ政権のエネルギー政策の大綱で、１９７０年代から事実上、凍結されている原子力発電所の新規建設を打ち出す考えを[ENT]示した。[SEP]松下精工は９日までに出荷直前のわずか１０分間で、細菌やカビなどの個数を[ENT]数え、食材の汚染を調べる「微生物計量システム」＝写真＝を開発した。
400	BEFORE	松下精工は９日までに出荷直前のわずか１０分間で、細菌やカビなどの個数を数え、食材の汚染を調べる「微生物計量システム」＝写真＝を[ENT]開発した。[SEP]食品工場向けなどに今年１２月に[ENT]商品化する。
401	VAGUE	食品工場向けなどに今年１２月に[ENT]商品化する。[SEP]大腸菌や黄色ブドウ球菌などの細菌を[ENT]蛍光染色し、特殊な発光ダイオード（ＬＥＤ）で照らして、画像をパソコンで解析する仕組み。
402	AFTER	高価な顕微鏡やレーザーを使用しないため、価格は１００万円程度に[ENT]抑えられると[ENT]いう。
403	OVERLAP	日本興業銀行は９日、企業向け融資の基準金利となる長期プライムレート（優遇貸出金利）を現行より０．１％[ENT]引き下げ、年１．７５％に[ENT]すると発表した。
404	AFTER	日本興業銀行は９日、企業向け融資の基準金利となる長期プライムレート（優遇貸出金利）を現行より０．１％引き下げ、年１．７５％に[ENT]すると[ENT]発表した。
405	BEFORE	日本興業銀行は９日、企業向け融資の基準金利となる長期プライムレート（優遇貸出金利）を現行より０．１％引き下げ、年１．７５％にすると[ENT]発表した。[SEP]１０日から[ENT]実施する。
406	AFTER	日本工作機械工業会が９日[ENT]発表した２０００年度の工作機械受注額（確報値）は前年度比２７．７％増の９９７５億１３００万円と３年ぶりに[ENT]増加した。
407	BEFORE	国内景気の緩やかな回復を受け、内需が好調に[ENT]推移した。[SEP]同時に[ENT]発表した３月の受注額（確報値）は、８２８億３８００万円と前年同月比１．４％の微増。
408	OVERLAP	ファミリーマートは９日、店舗内に[ENT]設置されているマルチメディア端末「Ｆａｍｉポート」で、シャープの携帯情報端末「ザウルス」のコンテンツを５月中旬から[ENT]販売すると発表した。
409	AFTER	ファミリーマートは９日、店舗内に設置されているマルチメディア端末「Ｆａｍｉポート」で、シャープの携帯情報端末「ザウルス」のコンテンツを５月中旬から[ENT]販売すると[ENT]発表した。
410	VAGUE	値段はインターネット上の販売価格と同じだが、ダウンロードする場合に比べて通信費が[ENT]かからない。[SEP]米ガートナー・グループ傘下の調査会社データクエストは８日、今年の世界半導体売上高が１８８４億ドルと前年比１６．７％[ENT]減少するとの予測を発表した。
411	AFTER	米ガートナー・グループ傘下の調査会社データクエストは８日、今年の世界半導体売上高が１８８４億ドルと前年比１６．７％[ENT]減少するとの予測を[ENT]発表した。
412	AFTER	道は九日、補助金を出している関与団体のあり方について、統廃合など新たな見直し計画を[ENT]設ける方針を[ENT]表明した。
413	OVERLAP	道は九日、補助金を出している関与団体のあり方について、統廃合など新たな見直し計画を設ける方針を[ENT]表明した。[SEP]道職員ＯＢの天下り先で、第二道庁とも[ENT]呼ばれる関与団体への税金投入に大ナタを振るい、危機に直面する道財政の負担を軽くする。
414	OVERLAP	道職員ＯＢの天下り先で、第二道庁とも[ENT]呼ばれる関与団体への税金投入に大ナタを[ENT]振るい、危機に直面する道財政の負担を軽くする。
415	OVERLAP	道職員ＯＢの天下り先で、第二道庁とも呼ばれる関与団体への税金投入に大ナタを[ENT]振るい、危機に[ENT]直面する道財政の負担を軽くする。
416	AFTER	道職員ＯＢの天下り先で、第二道庁とも呼ばれる関与団体への税金投入に大ナタを振るい、危機に直面する道財政の負担を軽く[ENT]する。[SEP]道議会予算特別委員会で高尾和彦総務部長が自民党の喜多龍一氏（十勝管内）の質問に[ENT]答えた。
417	AFTER	道議会予算特別委員会で高尾和彦総務部長が自民党の喜多龍一氏（十勝管内）の質問に[ENT]答えた。[SEP]一九九九年に[ENT]策定した現行の「見直し方針」を抜本的に改め、二〇〇二年度中に新計画を策定。
418	BEFORE	一九九九年に策定した現行の「見直し方針」を抜本的に[ENT]改め、二〇〇二年度中に新計画を策定。[SEP][UNK]―[UNK]年度の三年間で計画を[ENT]完了する。
419	AFTER	[UNK]―[UNK]年度の三年間で計画を[ENT]完了する。[SEP]国は七月に公益法人改革の具体化方針案を[ENT]まとめ、１役員報酬への助成２年間収入の三分の二以上を補助金に依存する組織―については補助金交付を見直す考えを打ち出している。
420	OVERLAP	国は七月に公益法人改革の具体化方針案を[ENT]まとめ、１役員報酬への助成２年間収入の三分の二以上を補助金に[ENT]依存する組織―については補助金交付を見直す考えを打ち出している。
421	OVERLAP	国は七月に公益法人改革の具体化方針案をまとめ、１役員報酬への助成２年間収入の三分の二以上を補助金に[ENT]依存する組織―については補助金交付を[ENT]見直す考えを打ち出している。
422	BEFORE	国は七月に公益法人改革の具体化方針案をまとめ、１役員報酬への助成２年間収入の三分の二以上を補助金に依存する組織―については補助金交付を見直す考えを[ENT]打ち出している。[SEP]道の新計画も国に[ENT]準じる見込みとされている。
423	AFTER	道の新計画も国に[ENT]準じる見込みと[ENT]されている。
424	BEFORE	道の新計画も国に準じる見込みと[ENT]されている。[SEP]さらに、職員数が十人以下の小規模団体は事務部門を[ENT]統合し、人件費や管理費の削減などを検討する。
425	OVERLAP	さらに、職員数が十人以下の小規模団体は事務部門を統合し、人件費や管理費の削減などを[ENT]検討する。[SEP]核燃料サイクル開発機構が[UNK]管内幌延町で[ENT]進めている深地層研究所計画で、道の吉沢慶信経済部長は九日の道議会予算特別委で、道と同町、核燃機構の三者が放射性廃棄物を持ち込ませないために結んだ協定について、履行状況を確認する機関の設置方針を示した。
426	BEFORE	核燃料サイクル開発機構が[UNK]管内幌延町で進めている深地層研究所計画で、道の吉沢慶信経済部長は九日の道議会予算特別委で、道と同町、核燃機構の三者が放射性廃棄物を持ち込ませないために[ENT]結んだ協定について、履行状況を[ENT]確認する機関の設置方針を示した。
427	AFTER	核燃料サイクル開発機構が[UNK]管内幌延町で進めている深地層研究所計画で、道の吉沢慶信経済部長は九日の道議会予算特別委で、道と同町、核燃機構の三者が放射性廃棄物を持ち込ませないために結んだ協定について、履行状況を[ENT]確認する機関の設置方針を[ENT]示した。
428	VAGUE	核燃料サイクル開発機構が[UNK]管内幌延町で進めている深地層研究所計画で、道の吉沢慶信経済部長は九日の道議会予算特別委で、道と同町、核燃機構の三者が放射性廃棄物を持ち込ませないために結んだ協定について、履行状況を確認する機関の設置方針を[ENT]示した。[SEP]民主党・道民連合の三津丈夫氏（帯広市）に[ENT]答えた。
429	BEFORE	民主党・道民連合の三津丈夫氏（帯広市）に[ENT]答えた。[SEP]確認機関が[ENT]チェックするのは、放射性廃棄物を持ち込ませないことのほか１核燃機構は積極的に情報公開に努める２三者は風評被害の未然防止措置について協議する―など協定十六項目の履行状況。
430	VAGUE	確認機関が[ENT]チェックするのは、放射性廃棄物を[ENT]持ち込ませないことのほか１核燃機構は積極的に情報公開に努める２三者は風評被害の未然防止措置について協議する―など協定十六項目の履行状況。
431	AFTER	道は、同計画の研究実施区域が決まる来年度をめどに確認機関を[ENT]設置する方針で現在、幌延町と[ENT]協議している。
432	OVERLAP	道は、同計画の研究実施区域が決まる来年度をめどに確認機関を設置する方針で現在、幌延町と[ENT]協議している。[SEP]宮城県で十三日から[ENT]始まる秋の国体に、堀達也知事が道体育協会会長として初参加することが、九日までに固まった。
433	AFTER	宮城県で十三日から始まる秋の国体に、堀達也知事が道体育協会会長として[ENT]初参加することが、九日までに[ENT]固まった。
434	BEFORE	宮城県で十三日から始まる秋の国体に、堀達也知事が道体育協会会長として初参加することが、九日までに[ENT]固まった。[SEP]道体協によると堀知事は十三日、同県利府町で[ENT]行われる開会式に道選手団長として入場。
