0	OVERLAP	高等部では自由な校風もあって、流行に乗ってかばんを薄くつぶしたり、ピアスを[ENT]したり。[SEP][ENT]呼び出して注意する先生もいたが、二、三年時に担任だった池田弘子先生（７５）は違った。
1	OVERLAP	やんわり[ENT]語りかける。[SEP]「頭ごなしでなく、子どもの目線に[ENT]立って、聞く耳を持たせてくれるんですよね」
2	BEFORE	障害や難病に苦しむ人の話をよく[ENT]取り上げ、生徒同士で[ENT]討論させた。
3	OVERLAP	台湾人の父を持ち、「家で蓮[UNK]さんは、いつも自己主張するよう教えられていた」率先して自分の意見を[ENT]言った。[SEP]「どこかみんなとは。[ENT]違っていたのかもしれない」
4	OVERLAP	「どこかみんなとは。[ENT]違っていたのかもしれない」[SEP]ほかの先生たちには、「おしゃべり」のレッテルを[ENT]張られていた。
5	OVERLAP	ほかの先生たちには、「おしゃべり」のレッテルを[ENT]張られていた。[SEP]それなのに、池田先生は[ENT]言ってくれたのだ。
6	BEFORE	「と、初めてしゃべるのが得意なんだから、能力を生かしてみたら」「おしゃべり」を[ENT]評価してくれた。[SEP]ブラウン管の中で[ENT]話すなんて、思ってもみないころだった。
7	AFTER	ブラウン管の中で[ENT]話すなんて、[ENT]思ってもみないころだった。
8	AFTER	大学に進学する時も、「あなたはと、法学部に論理的に考えるのが得意」[ENT]行くよう[ENT]促したのは池田先生。
9	BEFORE	大学に進学する時も、「あなたはと、法学部に論理的に考えるのが得意」行くよう[ENT]促したのは池田先生。[SEP]大学在学中に[ENT]デビューし、キャスターとして活躍するその後の進路を思うにつけ、「本当によくと見ていてくれた」感謝する。
10	BEFORE	大学在学中に[ENT]デビューし、キャスターとして[ENT]活躍するその後の進路を思うにつけ、「本当によくと見ていてくれた」感謝する。
11	AFTER	大学在学中にデビューし、キャスターとして活躍するその後の進路を思うにつけ、「本当によくと見ていてくれた」[ENT]感謝する。[SEP]池田先生も、蓮[UNK]さんに[ENT]アドバイスしたことを覚えていた。
12	BEFORE	池田先生も、蓮[UNK]さんに[ENT]アドバイスしたことを[ENT]覚えていた。
13	BEFORE	中学校教員を対象にＮＩＥ（教育に新聞を）活動の実践例を[ENT]報告し、活用に[ENT]役立てる「第７回ＮＩＥ講習会」が１７日午後２時３０分から、東京・内幸町の日本プレスセンターで開催される。
14	AFTER	中学校教員を対象にＮＩＥ（教育に新聞を）活動の実践例を報告し、活用に[ENT]役立てる「第７回ＮＩＥ講習会」が１７日午後２時３０分から、東京・内幸町の日本プレスセンターで[ENT]開催される。
15	OVERLAP	学童保育の全国組織、全国学童保育連絡協議会が１７、１８日、電話相談を[ENT]行う。[SEP]利用者の相談に[ENT]乗り、要望も集め厚生労働省に届ける。
16	OVERLAP	利用者の相談に[ENT]乗り、要望も[ENT]集め厚生労働省に届ける。
17	BEFORE	利用者の相談に乗り、要望も[ENT]集め厚生労働省に[ENT]届ける。
18	BEFORE	もみじの木に[ENT]とまって仲良く[ENT]寄り添う二羽のキジバト。
19	BEFORE	最初は離れて[ENT]とまっていたそうですが、やがて二羽が[ENT]並び、写真のように恋人同士を思わせるしぐさに移ったそうです。
20	BEFORE	最初は離れてとまっていたそうですが、やがて二羽が[ENT]並び、写真のように恋人同士を[ENT]思わせるしぐさに移ったそうです。
21	AFTER	最初は離れてとまっていたそうですが、やがて二羽が並び、写真のように恋人同士を[ENT]思わせるしぐさに[ENT]移ったそうです。
22	OVERLAP	バックが暗い中、ストロボの光が鳥に集光して、スポットライトを[ENT]当てたように[ENT]なったのと、タイミングよくまぶたを閉じてくれたことで、独特な雰囲気の写真になりました。
23	VAGUE	バックが暗い中、ストロボの光が鳥に集光して、スポットライトを当てたようになったのと、タイミングよくまぶたを閉じてくれたことで、独特な雰囲気の写真に[ENT]なりました。[SEP]「喜色満面」は、道を[ENT]まちがえて偶然出会った小さな石像です。
24	BEFORE	「喜色満面」は、道を[ENT]まちがえて偶然[ENT]出会った小さな石像です。
25	BEFORE	道や旅の安全を守る道祖神のひとつでしょうが、編み笠をかぶった人なつっこい笑顔を[ENT]見るだけで、旅の疲れも[ENT]取れそうです。
26	BEFORE	昨年四月に[ENT]オープンした大阪市北区の大阪国際会議場（グランキューブ大阪）の来場者が二十日、百万人を[ENT]突破した。
27	BEFORE	収支見込みも、当初は数年間の赤字が必至と[ENT]みられていたが、今月三十一日に[ENT]予定している初年度決算で「経常利益は数億円単位の黒字に（山下社長）となる」いう。
28	BEFORE	この日、百万人目の来場者と[ENT]なったのは兵庫県市川町の柴田愛子さんで、田中丈三支配人から花束などが[ENT]手渡された。
29	BEFORE	冷戦時代に激しいスパイ合戦を[ENT]演じた米中央情報局（ＣＩＡ）と旧ソ連・国家保安委員会（ＫＧＢ）の元エージェントたちと一週間のクルーズを[ENT]楽しむツアーを、スパイ活動の訓練や分析を業務とする米民間会社「ＣＩセンター」が企画した。
30	VAGUE	詳細は決定次第、同センターのホームページ（ｈｔｔｐ：／／ｗｗｗ．ｃｉｃｅｎｔｒｅ．ｃｏｍ／）に掲載されると[ENT]いう。[SEP][UNK]人民日報（中国）＝市場経済の秩序回復に[ENT]取り組むスワトー市
31	VAGUE	[UNK]人民日報（中国）＝市場経済の秩序回復に[ENT]取り組むスワトー市[SEP][UNK]中央日報（韓国）＝草案作成者でっち上げか―[ENT]政治問題化した新法相就任あいさつ
32	VAGUE	[UNK]中央日報（韓国）＝草案作成者でっち上げか―[ENT]政治問題化した新法相就任あいさつ[SEP]帝国データバンクは二十三日、二〇〇〇年中に決算を[ENT]まとめた企業の申告所得ランキングを発表した。
33	BEFORE	帝国データバンクは二十三日、二〇〇〇年中に決算を[ENT]まとめた企業の申告所得ランキングを[ENT]発表した。
34	AFTER	帝国データバンクは二十三日、二〇〇〇年中に決算をまとめた企業の申告所得ランキングを[ENT]発表した。[SEP]前年二位のトヨタ自動車が、円高の影響で売上高と経常利益を[ENT]減少させながらも、高級乗用車の販売好調に支えられ、三年ぶりに首位に返り咲いた。
35	OVERLAP	前年二位のトヨタ自動車が、円高の影響で売上高と経常利益を[ENT]減少させながらも、高級乗用車の販売好調に[ENT]支えられ、三年ぶりに首位に返り咲いた。
36	BEFORE	前年二位のトヨタ自動車が、円高の影響で売上高と経常利益を減少させながらも、高級乗用車の販売好調に[ENT]支えられ、三年ぶりに首位に[ENT]返り咲いた。
37	AFTER	前年二位のトヨタ自動車が、円高の影響で売上高と経常利益を減少させながらも、高級乗用車の販売好調に支えられ、三年ぶりに首位に[ENT]返り咲いた。[SEP]一方、不良債権の有税償却を[ENT]進めた金融機関の申告所得が膨らんで、上位十社中、東京三菱銀行など銀行・生保四社が名を連ね、低迷する日本経済の「負の側面」を象徴する結果になった。
38	OVERLAP	一方、不良債権の有税償却を進めた金融機関の申告所得が膨らんで、上位十社中、東京三菱銀行など銀行・生保四社が名を[ENT]連ね、[ENT]低迷する日本経済の「負の側面」を象徴する結果になった。
39	BEFORE	昨年一位だったＮＴＴは、純粋持ち株会社に[ENT]なり百二十一位に[ENT]大幅後退したが、グループ企業のＮＴＴドコモが携帯電話のインターネット接続サービス「ｉモード」の普及で五位、長距離・国際通信事業を展開するＮＴＴコミュニケーションズが十位と健闘した。
40	BEFORE	公示対象となる四千万円以上の所得を[ENT]申告した企業は、前年比六・四％増の七万八千六百三十二社で三年ぶりの増加。[SEP]所得金額合計も同一七・五％増の三十五兆六千百十九億円と四年ぶりに[ENT]増加した。
41	AFTER	所得金額合計も同一七・五％増の三十五兆六千百十九億円と四年ぶりに[ENT]増加した。[SEP]この背景には金融機関を中心に、不良債権処理の推進など財務体質の改善に[ENT]取り組んだことがある。
42	BEFORE	と[ENT]題して、話題作「ハリー・ポッター」の魅力についてを英語で[ENT]話す。
43	VAGUE	アンケート協力者の中から図書券（５００円分）を５０人、人間観察に[ENT]応募した中からイッセー尾形さんのサイン入り著書を５人にプレゼント。[SEP]名鉄[UNK]線・揖斐線（黒野―本揖[UNK]間）、八百津線・竹鼻線（江吉良―大須間）の廃止に[ENT]伴い、廃線区間の掲示物、電車での忘れ物などを販売。
44	VAGUE	名鉄[UNK]線・揖斐線（黒野―本揖[UNK]間）、八百津線・竹鼻線（江吉良―大須間）の廃止に[ENT]伴い、廃線区間の掲示物、電車での忘れ物などを販売。[SEP][UNK]メガネ無料券日本オプティカルは、ハートアップＷｅｂ名鉄豊田駅前店とハートアップＷｅｂ東岡崎店で「ジャスト３プライスメガネ販売」のスタートを[ENT]記念して、「メガネ無料券」（５０００円相当）を５人にプレゼント。
45	VAGUE	[UNK]メガネ無料券日本オプティカルは、ハートアップＷｅｂ名鉄豊田駅前店とハートアップＷｅｂ東岡崎店で「ジャスト３プライスメガネ販売」のスタートを[ENT]記念して、「メガネ無料券」（５０００円相当）を５人にプレゼント。[SEP][UNK]ユリの球根即売富山県名古屋事務所は、魚津、[UNK]市特産のユリの球根の即売を[ENT]始めた。
46	BEFORE	廃タイヤ回収は、町内会ごとに集積場所を決め、町民が[ENT]持ち込んだタイヤを旭川市内の処理業者に[ENT]引き渡す。
47	BEFORE	今月初めから町内全戸を対象に希望調査を[ENT]行っており、五月中旬から回収を[ENT]始める。
48	AFTER	今回の回収費用は千六百万―千八百万円かかる見込みで、同町が六百万円を[ENT]補助する。[SEP]米どころの同町では、降霜対策で農家による廃タイヤの野焼きが[ENT]行われてきたが、ダイオキシン問題や交通妨害が指摘され、行き場を失った廃タイヤがあぜ道や納屋の横に放置されてきた。
49	BEFORE	米どころの同町では、降霜対策で農家による廃タイヤの野焼きが行われてきたが、ダイオキシン問題や交通妨害が[ENT]指摘され、行き場を[ENT]失った廃タイヤがあぜ道や納屋の横に放置されてきた。
50	OVERLAP	米どころの同町では、降霜対策で農家による廃タイヤの野焼きが行われてきたが、ダイオキシン問題や交通妨害が指摘され、行き場を失った廃タイヤがあぜ道や納屋の横に[ENT]放置されてきた。[SEP]同町が昨秋[ENT]行った調査では、廃タイヤは農家が抱えるものや不法投棄を含め約三万本に上るという。
51	BEFORE	地方自治体が運営する公営地下鉄二十六路線のうち二〇〇〇年度決算で経常損益が黒字なのは、札幌市南北線など四路線にとどまったことが、公営交通事業協会が十日[ENT]まとめた報告書で[ENT]分かった。
52	BEFORE	札幌市南北線（七一年開業）は、市内で初めて開通した路線で、乗客が多いのも黒字確保の一因と[ENT]なったと[ENT]みられる。
53	VAGUE	札幌市南北線（七一年開業）は、市内で初めて開通した路線で、乗客が多いのも黒字確保の一因となったと[ENT]みられる。[SEP]公営地下鉄事業は、二〇〇〇年度末で、東京都と八政令市で延べ四百七十三キロが[ENT]営業している。
54	BEFORE	能力に応じて３クラス（各１０人）に[ENT]分け、３人の講師が週２回、すべて英語で授業を[ENT]する。
55	OVERLAP	能力に応じて３クラス（各１０人）に分け、３人の講師が週２回、すべて英語で授業を[ENT]する。[SEP]毎回宿題を[ENT]出し、答案には添削して返す。
56	BEFORE	毎回宿題を[ENT]出し、答案には[ENT]添削して返す。
57	BEFORE	毎回宿題を出し、答案には[ENT]添削して[ENT]返す。
58	VAGUE	毎回宿題を出し、答案には添削して[ENT]返す。[SEP]学生の研究に支障が[ENT]出ないよう、授業は午前８時半から１０時まで。
59	VAGUE	学生の研究に支障が[ENT]出ないよう、授業は午前８時半から１０時まで。[SEP]単位が[ENT]取れなくても「落第」はしないが、全員に受講を義務付ける。
60	AFTER	単位が取れなくても「落第」は[ENT]しないが、全員に受講を[ENT]義務付ける。
61	OVERLAP	単位が取れなくても「落第」はしないが、全員に受講を[ENT]義務付ける。[SEP]大学院では教育より研究が[ENT]重視される風潮があり、同大によると、大学院でのこうした取り組みは初めてという。
62	AFTER	大学院では教育より研究が重視される風潮があり、同大によると、大学院でのこうした取り組みは初めてと[ENT]いう。[SEP]化学専攻は昨年、文部科学省の「に２１世紀ＣＯＥ（センター・オブ・エクセレンス）プログラム」[ENT]選ばれた。
63	BEFORE	化学専攻は昨年、文部科学省の「に２１世紀ＣＯＥ（センター・オブ・エクセレンス）プログラム」[ENT]選ばれた。[SEP]研究・教育予算が５年間、１億〜５億円ずつ[ENT]加算されることになり、英語特別指導はその予算を利用する。
64	BEFORE	研究・教育予算が５年間、１億〜５億円ずつ[ENT]加算されることになり、英語特別指導はその予算を[ENT]利用する。
65	BEFORE	同専攻は英語教育のほかにも、博士課程の学生の約７割にあたる７１人を「研究補助員」として雇用する契約を[ENT]結び、研究活動に対して毎月７万５０００円の報酬を[ENT]支払う取り組みも始めた。
66	AFTER	同専攻は英語教育のほかにも、博士課程の学生の約７割にあたる７１人を「研究補助員」として雇用する契約を結び、研究活動に対して毎月７万５０００円の報酬を[ENT]支払う取り組みも[ENT]始めた。
67	VAGUE	同専攻は英語教育のほかにも、博士課程の学生の約７割にあたる７１人を「研究補助員」として雇用する契約を結び、研究活動に対して毎月７万５０００円の報酬を支払う取り組みも[ENT]始めた。[SEP]ブラジル東部オリンダで、カーニバルの中、男たちが通りすがりの女性に[ENT]キスする習慣ができ、市当局が取り締まりに乗り出した。
68	BEFORE	ブラジル東部オリンダで、カーニバルの中、男たちが通りすがりの女性にキスする習慣が[ENT]でき、市当局が取り締まりに[ENT]乗り出した。
69	BEFORE	ブラジル東部オリンダで、カーニバルの中、男たちが通りすがりの女性にキスする習慣ができ、市当局が取り締まりに[ENT]乗り出した。[SEP]強制わいせつ罪が[ENT]適用される。
70	VAGUE	強制わいせつ罪が[ENT]適用される。[SEP]米ＣＮＮテレビのプロデューサー、ウェンディ・ウィットワースさんの５０歳の誕生日、夫のラルフさんが[ENT]“プレゼント”したのは何と、元ビートルズのポール・マッカートニーのプライベートコンサートだった。
71	BEFORE	約１時間半のコンサートの終幕近くには、ポールはウェンディさんをステージに[ENT]上げ、ビートルズの「バースデイ」を[ENT]演奏したという。
72	BEFORE	約１時間半のコンサートの終幕近くには、ポールはウェンディさんをステージに上げ、ビートルズの「バースデイ」を[ENT]演奏したと[ENT]いう。
73	BEFORE	約１時間半のコンサートの終幕近くには、ポールはウェンディさんをステージに上げ、ビートルズの「バースデイ」を演奏したと[ENT]いう。[SEP]ポールは、報酬の１００万ドルを反地雷の慈善団体に[ENT]寄付するとしている。
74	BEFORE	９４年に経営破たんした旧東京協和、旧安全の両信用組合の不正融資事件に[ENT]絡み、背任など４罪に[ENT]問われた元労相、■■■■被告（６２）に対し、東京高裁は２５日、懲役４年の東京地裁判決（００年３月）を破棄し、改めて懲役３年６月の実刑を言い渡した。
75	BEFORE	９４年に経営破たんした旧東京協和、旧安全の両信用組合の不正融資事件に絡み、背任など４罪に[ENT]問われた元労相、■■■■被告（６２）に対し、東京高裁は２５日、懲役４年の東京地裁判決（００年３月）を[ENT]破棄し、改めて懲役３年６月の実刑を言い渡した。
76	BEFORE	９４年に経営破たんした旧東京協和、旧安全の両信用組合の不正融資事件に絡み、背任など４罪に問われた元労相、■■■■被告（６２）に対し、東京高裁は２５日、懲役４年の東京地裁判決（００年３月）を[ENT]破棄し、改めて懲役３年６月の実刑を[ENT]言い渡した。
77	BEFORE	■■元労相は無罪を[ENT]主張したが、安広文夫裁判長は４罪とも成立を[ENT]認め
78	OVERLAP	「なりふり構わず資金を調達しようと[ENT]した利欲目的の犯行。[SEP]国会議員の地位に[ENT]ありながら、不合理な弁解を繰り返し、反省もしていない」
79	OVERLAP	国会議員の地位にありながら、不合理な弁解を[ENT]繰り返し、反省も[ENT]していない」
80	BEFORE	と[ENT]断罪した。[SEP]元労相は[ENT]上告する方針。
81	AFTER	元労相は[ENT]上告する方針。[SEP]１審より[ENT]減刑した理由について安広裁判長は、詐欺の被害者である旧熊本工大（現崇城大学）側と今月４日に民事上の和解が成立したことをあげた。
82	AFTER	１審より[ENT]減刑した理由について安広裁判長は、詐欺の被害者である旧熊本工大（現崇城大学）側と今月４日に民事上の和解が[ENT]成立したことをあげた。
83	BEFORE	１審より減刑した理由について安広裁判長は、詐欺の被害者である旧熊本工大（現崇城大学）側と今月４日に民事上の和解が[ENT]成立したことを[ENT]あげた。
84	OVERLAP	元東京協和信組理事長の■■■■被告（５７）＝控訴＝らと[ENT]共謀して旧２信組から実姉の■■■■被告（上告中死亡）の[ENT]経営する企業に２７億円余を不正融資させた背任事件（９４年）について、判決は「回収見込みがと、その成立をないことを熟知しながら、信用組合側に融資を懇願した」認めた。
85	OVERLAP	元東京協和信組理事長の■■■■被告（５７）＝控訴＝らと共謀して旧２信組から実姉の■■■■被告（上告中死亡）の[ENT]経営する企業に２７億円余を[ENT]不正融資させた背任事件（９４年）について、判決は「回収見込みがと、その成立をないことを熟知しながら、信用組合側に融資を懇願した」認めた。
86	OVERLAP	元東京協和信組理事長の■■■■被告（５７）＝控訴＝らと共謀して旧２信組から実姉の■■■■被告（上告中死亡）の経営する企業に２７億円余を[ENT]不正融資させた背任事件（９４年）について、判決は「回収見込みがと、その成立を[ENT]ないことを熟知しながら、信用組合側に融資を懇願した」認めた。
87	OVERLAP	元東京協和信組理事長の■■■■被告（５７）＝控訴＝らと共謀して旧２信組から実姉の■■■■被告（上告中死亡）の経営する企業に２７億円余を不正融資させた背任事件（９４年）について、判決は「回収見込みがと、その成立を[ENT]ないことを[ENT]熟知しながら、信用組合側に融資を懇願した」認めた。
88	OVERLAP	元東京協和信組理事長の■■■■被告（５７）＝控訴＝らと共謀して旧２信組から実姉の■■■■被告（上告中死亡）の経営する企業に２７億円余を不正融資させた背任事件（９４年）について、判決は「回収見込みがと、その成立をないことを[ENT]熟知しながら、信用組合側に融資を[ENT]懇願した」認めた。
89	BEFORE	元東京協和信組理事長の■■■■被告（５７）＝控訴＝らと共謀して旧２信組から実姉の■■■■被告（上告中死亡）の経営する企業に２７億円余を不正融資させた背任事件（９４年）について、判決は「回収見込みがと、その成立をないことを熟知しながら、信用組合側に融資を[ENT]懇願した」[ENT]認めた。
90	OVERLAP	国民審査[ENT]受ける最高裁９裁判官[SEP]最高裁裁判官の国民審査が九日、衆院選投票と同時に[ENT]実施される。
91	OVERLAP	最高裁裁判官の国民審査が九日、衆院選投票と同時に[ENT]実施される。[SEP]共同通信社は今回審査を[ENT]受ける九人の裁判官にアンケートをした。
92	AFTER	共同通信社は今回審査を[ENT]受ける九人の裁判官にアンケートを[ENT]した。
93	BEFORE	検討されている課題は多いが、中でも裁判官と国民から[ENT]選ばれた裁判員が[ENT]協力し、刑事事件の審理、判決を行う裁判員制度の導入は、国民の司法参加の象徴ともいえ、大きな目玉の一つだ。
94	AFTER	そこで１最高裁裁判官としての信条や審理に当たっての心構え２裁判員制度が[ENT]実施された場合、裁判官と裁判員それぞれに[ENT]期待することは何か。
95	VAGUE	円滑に運営するための環境整備や不安を[ENT]感じる点など制度全般への意見３制度を[ENT]議論する過程で浮上している事件報道に関するメディア規制などをどう考えるか―の三点を質問した。
96	OVERLAP	円滑に運営するための環境整備や不安を感じる点など制度全般への意見３制度を[ENT]議論する過程で[ENT]浮上している事件報道に関するメディア規制などをどう考えるか―の三点を質問した。
97	AFTER	円滑に運営するための環境整備や不安を感じる点など制度全般への意見３制度を議論する過程で浮上している事件報道に関するメディア規制などをどう考えるか―の三点を[ENT]質問した。[SEP]東京高裁長官を[ENT]経て０２年１１月最高裁判事。
98	VAGUE	１民主主義のシステムが正常に動いているかを監視、多数決原理で取り残されがちな少数者の権利を救済する司法の役割を[ENT]果たす。[SEP]２制度自体に不安は[ENT]感じない。
99	OVERLAP	裁判官も裁判員も冷静な心をもって[ENT]当たればいい。[SEP]ただ事件増で裁判官も法廷も[ENT]足りないという現実との調和が最も必要。
100	OVERLAP	ただ事件増で裁判官も法廷も[ENT]足りないという現実との調和が最も必要。[SEP]３具体的事件で裁判員などへの取材は[ENT]控えるべきだ。
101	OVERLAP	テレビ朝日のダイオキシン報道に対し真実性の証明を不十分とした判決（０３年１０月）で「報道のと補足意見。全体的な意義を[ENT]評価することに変わり[ENT]ない」
102	AFTER	テレビ朝日のダイオキシン報道に対し真実性の証明を不十分とした判決（０３年１０月）で「報道のと補足意見。全体的な意義を評価することに変わり[ENT]ない」[SEP]広島、大阪各高裁長官を[ENT]経て０２年２月最高裁判事。
103	BEFORE	当事者の声に耳を[ENT]傾け、最高裁として[ENT]取り上げるべきかを冷静、公正、迅速に叡智と勇気をもって判断していく。
