647	BEFORE	星条旗で顔を覆ったが、取り外した後、イラク国旗を首に[ENT]ぶらさげた。[SEP]倒壊の瞬間、大歓声が[ENT]上がった。
648	OVERLAP	２３・５０（１７・５０）米空母キティホーク艦上で、像が[ENT]倒された瞬間をテレビで[ENT]見た軍医ロルフ・シュミット大尉は、
649	OVERLAP	これ以上、命が[ENT]失われないことを[ENT]願っている」
650	AFTER	これ以上、命が失われないことを[ENT]願っている」[SEP]国連安全保障理事会は９日午前１０時半（日本時間午後１１時半）から北朝鮮の核問題で非公式協議を[ENT]行った。
651	BEFORE	国連安全保障理事会は９日午前１０時半（日本時間午後１１時半）から北朝鮮の核問題で非公式協議を[ENT]行った。[SEP]北朝鮮の核不拡散条約（ＮＰＴ）からの脱退宣言が１０日に９０日間の「脱退通告期間」切れと[ENT]なるとされるのを受けた協議だが、安保理議長による非難声明を出すよう求めた米国に対し、中国が強く反対、具体的な対応策はまとまらなかった。
652	BEFORE	北朝鮮の核不拡散条約（ＮＰＴ）からの脱退宣言が１０日に９０日間の「脱退通告期間」切れとなるとされるのを[ENT]受けた協議だが、安保理議長による非難声明を[ENT]出すよう求めた米国に対し、中国が強く反対、具体的な対応策はまとまらなかった。
653	AFTER	北朝鮮の核不拡散条約（ＮＰＴ）からの脱退宣言が１０日に９０日間の「脱退通告期間」切れとなるとされるのを受けた協議だが、安保理議長による非難声明を[ENT]出すよう[ENT]求めた米国に対し、中国が強く反対、具体的な対応策はまとまらなかった。
654	BEFORE	北朝鮮の核不拡散条約（ＮＰＴ）からの脱退宣言が１０日に９０日間の「脱退通告期間」切れとなるとされるのを受けた協議だが、安保理議長による非難声明を出すよう求めた米国に対し、中国が強く反対、具体的な対応策は[ENT]まとまらなかった。[SEP]協議終了後、[ENT]記者会見した議長国メキシコのジンセール国連大使は各国がこの問題について「懸念をと表明した」述べるにとどまった。
655	AFTER	協議終了後、[ENT]記者会見した議長国メキシコのジンセール国連大使は各国がこの問題について「懸念をと[ENT]表明した」述べるにとどまった。
656	BEFORE	協議終了後、記者会見した議長国メキシコのジンセール国連大使は各国がこの問題について「懸念をと[ENT]表明した」[ENT]述べるにとどまった。
657	OVERLAP	協議終了後、記者会見した議長国メキシコのジンセール国連大使は各国がこの問題について「懸念をと表明した」[ENT]述べるに[ENT]とどまった。
658	AFTER	これに対し、王英凡・中国大使は米朝間の交渉による解決を図るべきだという立場から、強く[ENT]反対した。[SEP]北朝鮮の核問題は２月１９日に国際原子力機関（ＩＡＥＡ）の付託を[ENT]受け安保理に舞台が移ったが、実務レベルで協議すにるとどまっていた。
659	BEFORE	北朝鮮の核問題は２月１９日に国際原子力機関（ＩＡＥＡ）の付託を[ENT]受け安保理に舞台が[ENT]移ったが、実務レベルで協議すにるとどまっていた。
660	BEFORE	北朝鮮の核問題は２月１９日に国際原子力機関（ＩＡＥＡ）の付託を受け安保理に舞台が[ENT]移ったが、実務レベルで[ENT]協議すにるとどまっていた。
661	BEFORE	欧州とロシアを歴訪したベーカー米大統領特使は、元大統領フセイン拘束の政治的追い風を[ENT]受けて、フランス、ドイツ、イタリアからイラクの債務削減に基本合意を[ENT]取り付け、ロシアからも債務削減交渉への参加の言質を得る成果をあげた。
662	BEFORE	一方、米国に[ENT]歩み寄ったフランスやドイツは、債務削減問題を、イラク復興で国際社会が[ENT]再団結するきっかけにしたい意向だ。
663	AFTER	一方、米国に歩み寄ったフランスやドイツは、債務削減問題を、イラク復興で国際社会が[ENT]再団結するきっかけに[ENT]したい意向だ。
664	BEFORE	ドビルパン仏外相は十八日、仏記者団との内輪の懇談で、米欧対立の解消に[ENT]向け、「フセイン拘束が大いにと[ENT]役立つ」述べ、独露両国と“反戦連合”を組んだ仏政府にも、イラク再建に積極関与していく環境が整ってきたことを強調した。
665	AFTER	ドビルパン仏外相は十八日、仏記者団との内輪の懇談で、米欧対立の解消に向け、「フセイン拘束が大いにと[ENT]役立つ」[ENT]述べ、独露両国と“反戦連合”を組んだ仏政府にも、イラク再建に積極関与していく環境が整ってきたことを強調した。
666	AFTER	ドビルパン仏外相は十八日、仏記者団との内輪の懇談で、米欧対立の解消に向け、「フセイン拘束が大いにと役立つ」[ENT]述べ、独露両国と“反戦連合”を[ENT]組んだ仏政府にも、イラク再建に積極関与していく環境が整ってきたことを強調した。
667	BEFORE	ドビルパン仏外相は十八日、仏記者団との内輪の懇談で、米欧対立の解消に向け、「フセイン拘束が大いにと役立つ」述べ、独露両国と“反戦連合”を[ENT]組んだ仏政府にも、イラク再建に[ENT]積極関与していく環境が整ってきたことを強調した。
668	AFTER	ドビルパン仏外相は十八日、仏記者団との内輪の懇談で、米欧対立の解消に向け、「フセイン拘束が大いにと役立つ」述べ、独露両国と“反戦連合”を組んだ仏政府にも、イラク再建に[ENT]積極関与していく環境が[ENT]整ってきたことを強調した。
669	BEFORE	ドビルパン仏外相は十八日、仏記者団との内輪の懇談で、米欧対立の解消に向け、「フセイン拘束が大いにと役立つ」述べ、独露両国と“反戦連合”を組んだ仏政府にも、イラク再建に積極関与していく環境が整ってきたことを[ENT]強調した。[SEP]仏政府には債務問題を財政面だけでなく、主権回復など政治プロセスに[ENT]リンクさせ、イラク再建を国際社会全体で取り組む契機にしたい意向が働く。
670	AFTER	仏政府には債務問題を財政面だけでなく、主権回復など政治プロセスにリンクさせ、イラク再建を国際社会全体で[ENT]取り組む契機に[ENT]したい意向が働く。
671	BEFORE	ベーカー特使の訪仏を[ENT]歓迎したシラク仏大統領が、債務問題を[ENT]協議する場として、欧米、日本の十九か国で構成する主要債権国会議（パリクラブ＝＝）の多国間の枠組みを改めて念押ししたのも、そのためだった。
672	AFTER	ベーカー特使の訪仏を歓迎したシラク仏大統領が、債務問題を協議する場として、欧米、日本の十九か国で構成する主要債権国会議（パリクラブ＝＝）の多国間の枠組みを改めて[ENT]念押ししたのも、そのためだった。[SEP]イラクはフセイン政権時代、軍備やインフラ整備のため、世界第二位の埋蔵石油を事実上の担保に[ENT]借りまくった。
673	BEFORE	イラクはフセイン政権時代、軍備やインフラ整備のため、世界第二位の埋蔵石油を事実上の担保に[ENT]借りまくった。[SEP]債務総額は一千二百億ドルに[ENT]上る。
674	BEFORE	返済が困難に[ENT]なった開発途上国の公的債務問題について[ENT]協議する日米欧１９か国の非公式会合。
675	AFTER	このため、ドビルパン外相は「とさる十月のマドリード支援国会議のような、政治的再建を[ENT]話し合う国際会議を[ENT]開催してはどうか」提言する。
676	AFTER	このため、ドビルパン外相は「とさる十月のマドリード支援国会議のような、政治的再建を話し合う国際会議を[ENT]開催してはどうか」[ENT]提言する。
677	VAGUE	フセイン拘束は間違いなく米欧対立の“雪解け”のきっかけと[ENT]なりつつある。[SEP]仏政府関係者は「米国が多国間協力体制の確立にと[ENT]本気かどうかを判断する上で、債務問題は格好の試金石」見ている。
678	VAGUE	仏政府関係者は「米国が多国間協力体制の確立にと[ENT]本気かどうかを[ENT]判断する上で、債務問題は格好の試金石」見ている。
679	BEFORE	イラク戦争に先立って[ENT]公表された同国の大量破壊兵器に関する情報に疑問符が[ENT]付いている問題で、ブッシュ米大統領は九日の閣議後に記者団に対し「大量破壊兵器開発計画がと自信をあったことを突き止められるものと間違いなく確信している」表明した。
680	AFTER	イラク戦争に先立って公表された同国の大量破壊兵器に関する情報に疑問符が[ENT]付いている問題で、ブッシュ米大統領は九日の閣議後に記者団に対し「大量破壊兵器開発計画がと自信を[ENT]あったことを突き止められるものと間違いなく確信している」表明した。
681	BEFORE	イラク戦争に先立って公表された同国の大量破壊兵器に関する情報に疑問符が付いている問題で、ブッシュ米大統領は九日の閣議後に記者団に対し「大量破壊兵器開発計画がと自信を[ENT]あったことを[ENT]突き止められるものと間違いなく確信している」表明した。
682	OVERLAP	イラク戦争に先立って公表された同国の大量破壊兵器に関する情報に疑問符が付いている問題で、ブッシュ米大統領は九日の閣議後に記者団に対し「大量破壊兵器開発計画がと自信をあったことを突き止められるものと間違いなく[ENT]確信している」[ENT]表明した。
683	AFTER	イラク戦争に先立って公表された同国の大量破壊兵器に関する情報に疑問符が付いている問題で、ブッシュ米大統領は九日の閣議後に記者団に対し「大量破壊兵器開発計画がと自信をあったことを突き止められるものと間違いなく確信している」[ENT]表明した。[SEP]パウエル米国務長官も、前日の八日に[ENT]出演した米ＦＯＸニュースの番組で、戦争前の二月に、国連安全保障理事会でイラクの大量破壊兵器[UNK]の機密情報を開示したことについて「と四日間、夜通しで精査したＣＩＡ（中央情報局）の情報だ」明かし「と今後、[UNK]の証拠が見つかることを確信している」言明した。
684	AFTER	パウエル米国務長官も、前日の八日に[ENT]出演した米ＦＯＸニュースの番組で、戦争前の二月に、国連安全保障理事会でイラクの大量破壊兵器[UNK]の機密情報を[ENT]開示したことについて「と四日間、夜通しで精査したＣＩＡ（中央情報局）の情報だ」明かし「と今後、[UNK]の証拠が見つかることを確信している」言明した。
685	AFTER	パウエル米国務長官も、前日の八日に出演した米ＦＯＸニュースの番組で、戦争前の二月に、国連安全保障理事会でイラクの大量破壊兵器[UNK]の機密情報を[ENT]開示したことについて「と四日間、夜通しで[ENT]精査したＣＩＡ（中央情報局）の情報だ」明かし「と今後、[UNK]の証拠が見つかることを確信している」言明した。
686	BEFORE	パウエル米国務長官も、前日の八日に出演した米ＦＯＸニュースの番組で、戦争前の二月に、国連安全保障理事会でイラクの大量破壊兵器[UNK]の機密情報を開示したことについて「と四日間、夜通しで[ENT]精査したＣＩＡ（中央情報局）の情報だ」[ENT]明かし「と今後、[UNK]の証拠が見つかることを確信している」言明した。
687	BEFORE	パウエル米国務長官も、前日の八日に出演した米ＦＯＸニュースの番組で、戦争前の二月に、国連安全保障理事会でイラクの大量破壊兵器[UNK]の機密情報を開示したことについて「と四日間、夜通しで精査したＣＩＡ（中央情報局）の情報だ」[ENT]明かし「と今後、[UNK]の証拠が[ENT]見つかることを確信している」言明した。
688	AFTER	パウエル米国務長官も、前日の八日に出演した米ＦＯＸニュースの番組で、戦争前の二月に、国連安全保障理事会でイラクの大量破壊兵器[UNK]の機密情報を開示したことについて「と四日間、夜通しで精査したＣＩＡ（中央情報局）の情報だ」明かし「と今後、[UNK]の証拠が[ENT]見つかることを[ENT]確信している」言明した。
689	OVERLAP	パウエル米国務長官も、前日の八日に出演した米ＦＯＸニュースの番組で、戦争前の二月に、国連安全保障理事会でイラクの大量破壊兵器[UNK]の機密情報を開示したことについて「と四日間、夜通しで精査したＣＩＡ（中央情報局）の情報だ」明かし「と今後、[UNK]の証拠が見つかることを[ENT]確信している」[ENT]言明した。
690	AFTER	米国は[UNK]や（同兵器）開発に疑いの余地はないと考えているが、証拠を[ENT]見つけるにはもう少しの忍耐が必要」[SEP]と[ENT]述べた。
691	OVERLAP	ＣＢＳテレビでは「大量破壊兵器に関する多くの文書をと入手しており、多くのフセイン政権関係者の取り調べも[ENT]続けている」[ENT]して、捜索予定の関連施設がまだ多数あることを明らかにした。
692	AFTER	ＣＢＳテレビでは「大量破壊兵器に関する多くの文書をと入手しており、多くのフセイン政権関係者の取り調べも続けている」して、捜索予定の関連施設がまだ多数あることを明らかに[ENT]した。[SEP]この問題では、米メディアが先週末に、国防情報局（ＤＩＡ）が[ENT]作成した昨年九月の報告書に、「大量破壊兵器[UNK]については、と十分な情報はない」記載されていたと報道。
693	AFTER	ジャコビーＤＩＡ局長が記者会見で、報告書の存在を[ENT]認めたうえで[SEP]「一文節を[ENT]抽出して書いた報道。
694	AFTER	「一文節を抽出して[ENT]書いた報道。[SEP]フセイン政権の化学兵器の[UNK]や開発は[ENT]確信していた」
695	BEFORE	フセイン政権の化学兵器の[UNK]や開発は[ENT]確信していた」[SEP]と[ENT]反論した。
696	BEFORE	米紙ワシントン・ポストは、やはり先週、チェイニー副大統領がイラク戦争前に、ＣＩＡを頻繁に訪問、イラクの大量破壊兵器や国際テロ組織、アルカーイダの情報を[ENT]収集していたと[ENT]報じ「開戦と大量破壊兵器開発情報に整合性をと持たせるようにという無言の圧力を感じた」するＣＩＡ担当官の証言を伝えている。
697	AFTER	米紙ワシントン・ポストは、やはり先週、チェイニー副大統領がイラク戦争前に、ＣＩＡを頻繁に訪問、イラクの大量破壊兵器や国際テロ組織、アルカーイダの情報を収集していたと[ENT]報じ「開戦と大量破壊兵器開発情報に整合性をと[ENT]持たせるようにという無言の圧力を感じた」するＣＩＡ担当官の証言を伝えている。
698	BEFORE	米紙ワシントン・ポストは、やはり先週、チェイニー副大統領がイラク戦争前に、ＣＩＡを頻繁に訪問、イラクの大量破壊兵器や国際テロ組織、アルカーイダの情報を収集していたと報じ「開戦と大量破壊兵器開発情報に整合性をと持たせるようにという無言の圧力を[ENT]感じた」[ENT]するＣＩＡ担当官の証言を伝えている。
699	BEFORE	米紙ワシントン・ポストは、やはり先週、チェイニー副大統領がイラク戦争前に、ＣＩＡを頻繁に訪問、イラクの大量破壊兵器や国際テロ組織、アルカーイダの情報を収集していたと報じ「開戦と大量破壊兵器開発情報に整合性をと持たせるようにという無言の圧力を感じた」[ENT]するＣＩＡ担当官の証言を[ENT]伝えている。
700	OVERLAP	米紙ワシントン・ポストは、やはり先週、チェイニー副大統領がイラク戦争前に、ＣＩＡを頻繁に訪問、イラクの大量破壊兵器や国際テロ組織、アルカーイダの情報を収集していたと報じ「開戦と大量破壊兵器開発情報に整合性をと持たせるようにという無言の圧力を感じた」するＣＩＡ担当官の証言を[ENT]伝えている。[SEP]米上院軍事委員会のレビン議員（民主党）は同日、ＮＢＣテレビで、米国の威信に[ENT]かかわる問題だとし「テロとの戦いで各国をと率いていくには、米国が表明することは事実であるという信頼が不可欠だ」して、議会での徹底究明を訴えた。
701	OVERLAP	米上院軍事委員会のレビン議員（民主党）は同日、ＮＢＣテレビで、米国の威信に[ENT]かかわる問題だと[ENT]し「テロとの戦いで各国をと率いていくには、米国が表明することは事実であるという信頼が不可欠だ」して、議会での徹底究明を訴えた。
702	VAGUE	米上院軍事委員会のレビン議員（民主党）は同日、ＮＢＣテレビで、米国の威信にかかわる問題だとし「テロとの戦いで各国をと率いていくには、米国が表明することは事実であるという信頼が不可欠だ」して、議会での徹底究明を[ENT]訴えた。[SEP]民主党の大統領候補の一人、ゲッパート前下院院内総務は同日、大量破壊兵器開発の証拠発見はこれからだとの見解を[ENT]示す一方、「ブッシュ大統領をはじめ、世界の指導者が偽情報をとも得ていたとしたら、驚くべきでっちあげだ」指摘した。
703	AFTER	民主党の大統領候補の一人、ゲッパート前下院院内総務は同日、大量破壊兵器開発の証拠発見はこれからだとの見解を[ENT]示す一方、「ブッシュ大統領をはじめ、世界の指導者が偽情報をとも[ENT]得ていたとしたら、驚くべきでっちあげだ」指摘した。
704	AFTER	民主党の大統領候補の一人、ゲッパート前下院院内総務は同日、大量破壊兵器開発の証拠発見はこれからだとの見解を示す一方、「ブッシュ大統領をはじめ、世界の指導者が偽情報をとも得ていたとしたら、驚くべきでっちあげだ」[ENT]指摘した。[SEP]上院情報委員会のロバーツ委員長（共和党）は同日、ＣＮＮテレビで、「現段階で、情報がどのようにと[ENT]扱われたか議会が調査するのは時期尚早」し「問題がと民主党を政治利用されるとすれば非生産的」批判した。
705	BEFORE	上院情報委員会のロバーツ委員長（共和党）は同日、ＣＮＮテレビで、「現段階で、情報がどのようにと[ENT]扱われたか議会が[ENT]調査するのは時期尚早」し「問題がと民主党を政治利用されるとすれば非生産的」批判した。
706	AFTER	上院情報委員会のロバーツ委員長（共和党）は同日、ＣＮＮテレビで、「現段階で、情報がどのようにと扱われたか議会が[ENT]調査するのは時期尚早」[ENT]し「問題がと民主党を政治利用されるとすれば非生産的」批判した。
707	BEFORE	上院情報委員会のロバーツ委員長（共和党）は同日、ＣＮＮテレビで、「現段階で、情報がどのようにと扱われたか議会が調査するのは時期尚早」[ENT]し「問題がと民主党を[ENT]政治利用されるとすれば非生産的」批判した。
708	AFTER	金泳三元韓国大統領に[ENT]聞く[SEP]韓国の金泳三元大統領＝写真＝が九日、東京都内で産経新聞とのインタビューに[ENT]応じた。
709	OVERLAP	だが、その一方、若者でにぎわう福岡市の大名や親富孝通りのショップやクラブがハングルで[ENT]紹介されている。[SEP]早速、ＨＰを[ENT]開設している「インディペンデントファクトリーフクオカ」（中央区）へ。
710	OVERLAP	現場責任者の大木聡美（三二）は「予想以上に、韓国の若者の目は福岡にと[ENT]向いている」[ENT]語る。
711	AFTER	現場責任者の大木聡美（三二）は「予想以上に、韓国の若者の目は福岡にと向いている」[ENT]語る。[SEP]福岡の音楽を[ENT]紹介するためにＨＰを開いたが、ファッション情報などへの反響が大きく、文化全般を紹介する動画を増やしたという。
712	AFTER	福岡の音楽を[ENT]紹介するためにＨＰを[ENT]開いたが、ファッション情報などへの反響が大きく、文化全般を紹介する動画を増やしたという。
713	BEFORE	福岡の音楽を紹介するためにＨＰを開いたが、ファッション情報などへの反響が大きく、文化全般を紹介する動画を[ENT]増やしたと[ENT]いう。
714	VAGUE	でも、文化を通じて交流を深めることが入り口に[ENT]なる」[SEP]ＨＰを[ENT]見て福岡を訪れた韓国の若者と一緒に買い物を楽しみ、ライブに出かけることもある。
715	BEFORE	ＨＰを[ENT]見て福岡を[ENT]訪れた韓国の若者と一緒に買い物を楽しみ、ライブに出かけることもある。
716	BEFORE	ＨＰを見て福岡を[ENT]訪れた韓国の若者と一緒に買い物を[ENT]楽しみ、ライブに出かけることもある。
717	VAGUE	ＨＰを見て福岡を訪れた韓国の若者と一緒に買い物を[ENT]楽しみ、ライブに[ENT]出かけることもある。
718	OVERLAP	ネットの世界にとどまらず「のだ。気軽に顔を[ENT]合わせられる近さが[ENT]ある」
719	OVERLAP	昨年十月から二カ月間、アジア六カ国・地域を[ENT]回り、中国で[ENT]出会った無名の日本人ミュージシャンの話に驚いた。
720	BEFORE	昨年十月から二カ月間、アジア六カ国・地域を回り、中国で[ENT]出会った無名の日本人ミュージシャンの話に[ENT]驚いた。
721	AFTER	昨年十月から二カ月間、アジア六カ国・地域を回り、中国で出会った無名の日本人ミュージシャンの話に[ENT]驚いた。[SEP]「これまでのライブで、四億人が歌を。[ENT]聴いてくれた」
722	BEFORE	「これまでのライブで、四億人が歌を。[ENT]聴いてくれた」[SEP]中国の音楽関係者は[ENT]言った。
723	AFTER	中国の音楽関係者は[ENT]言った。[SEP]「新人のＣＤは二千万枚。[ENT]売れた」
724	OVERLAP	「。巨額の宣伝費に頼るメジャー（大手レコード会社）の手法でなくても福岡の音楽を[ENT]広める道は[ENT]ある」
725	AFTER	アーティスト発掘、売り込みの拠点として年内に中国・上海にライブハウスを[ENT]開設する。[SEP]所属歌手のＭＥＬＡ（二二）＝福岡出身＝は「東京よりアジアでと、自作曲を韓国語にアレンジ。[ENT]ヒットしたい」
726	BEFORE	所属歌手のＭＥＬＡ（二二）＝福岡出身＝は「東京よりアジアでと、自作曲を韓国語にアレンジ。[ENT]ヒットしたい」[SEP]九月発売予定のミニアルバムにも収録、十月には韓国のライブで[ENT]歌う。
727	OVERLAP	九月発売予定のミニアルバムにも収録、十月には韓国のライブで[ENT]歌う。[SEP]今や、自宅のパソコンでも[ENT]レコーディングできる時代。
728	OVERLAP	今や、自宅のパソコンでも[ENT]レコーディングできる時代。[SEP]「東京で[ENT]認められなくてもアジアで売れるアーティストが誕生すると思う。
729	BEFORE	「東京で[ENT]認められなくてもアジアで[ENT]売れるアーティストが誕生すると思う。
730	AFTER	「東京で認められなくてもアジアで売れるアーティストが[ENT]誕生すると[ENT]思う。
731	OVERLAP	東京を[ENT]経由する必要は[ENT]ない」
732	VAGUE	韓国語か中国語で[ENT]歌ってみないか？」[SEP]ミュージシャンの動画制作を[ENT]チェックする「インディペンデントファクトリーフクオカ」の大木さん（奥）
733	OVERLAP	韓国語にアレンジした歌詞を[ENT]見ながら[ENT]歌うＭＥＬＡ
734	BEFORE	韓国語にアレンジした歌詞を見ながら[ENT]歌うＭＥＬＡ[SEP]「都市探究」シリーズ（週５回）へのご意見、ご感想を[ENT]お待ちしています。
